{
  "level_id": "level03",
  "display_name": "level03",
  "beat_bpm": 80,
  "failure_beat_limit": 400,
  "cells": [
    {
      "x": 4,
      "y": 13,
      "producer": {
        "facing": "RIGHT",
        "beat_interval": 12,
        "production_sequence": [
          "C",

          "C",

          "C",

          "C",

          "C",

          "C"

        ]
      }
    },
    {
      "x": 5,
      "y": 13,
      "belt": {
        "input_direction": "RIGHT",
        "output_direction": "RIGHT",
        "beat_interval": 1
      }
    },
    {
      "x": 6,
      "y": 13,
      "belt": {
        "input_direction": "RIGHT",
        "output_direction": "RIGHT",
        "beat_interval": 1
      }
    },
    {
      "x": 7,
      "y": 13,
      "belt": {
        "input_direction": "RIGHT",
        "output_direction": "RIGHT",
        "beat_interval": 1
      }
    },
    {
      "x": 8,
      "y": 13,
      "belt": {
        "input_direction": "RIGHT",
        "output_direction": "RIGHT",
        "beat_interval": 1
      }
    },
    {
      "x": 9,
      "y": 13,
      "belt": {
        "input_direction": "RIGHT",
        "output_direction": "UP",
        "beat_interval": 1
      }
    },
    {
      "x": 9,
      "y": 12,
      "belt": {
        "input_direction": "UP",
        "output_direction": "UP",
        "beat_interval": 1
      }
    },
    {
      "x": 9,
      "y": 11,
      "belt": {
        "input_direction": "UP",
        "output_direction": "UP",
        "beat_interval": 1
      }
    },
    {
      "x": 9,
      "y": 10,
      "belt": {
        "input_direction": "UP",
        "output_direction": "UP",
        "beat_interval": 1
      }
    },
    {
      "x": 9,
      "y": 9,
      "belt": {
        "input_direction": "UP",
        "output_direction": "LEFT",
        "beat_interval": 1
      }
    },
    {
      "x": 8,
      "y": 9,
      "belt": {
        "input_direction": "LEFT",
        "output_direction": "LEFT",
        "beat_interval": 1
      }
    },
    {
      "x": 7,
      "y": 9,
      "belt": {
        "input_direction": "LEFT",
        "output_direction": "LEFT",
        "beat_interval": 1
      }
    },
    {
      "x": 6,
      "y": 9,
      "belt": {
        "input_direction": "LEFT",
        "output_direction": "LEFT",
        "beat_interval": 1
      }
    },
    {
      "x": 6,
      "y": 10,
      "packer": {
        "facing": "DOWN",
        "transport_beat_interval": 1

      }
    },
    {
      "x": 5,
      "y": 9,
      "belt": {
        "input_direction": "LEFT",
        "output_direction": "DOWN",
        "beat_interval": 1
      }
    },
    {
      "x": 5,
      "y": 10,
      "belt": {
        "input_direction": "DOWN",
        "output_direction": "DOWN",
        "beat_interval": 1
      }
    },
    {
      "x": 5,
      "y": 11,
      "belt": {
        "input_direction": "DOWN",
        "output_direction": "DOWN",
        "beat_interval": 1
      }
    },
    {
      "x": 5,
      "y": 12,
      "belt": {
        "input_direction": "DOWN",
        "output_direction": "RIGHT",
        "beat_interval": 1
      }
    },
    {
      "x": 6,
      "y": 12,
      "belt": {
        "input_direction": "RIGHT",
        "output_direction": "RIGHT",
        "beat_interval": 1
      }
    },
    {
      "x": 7,
      "y": 12,
      "belt": {
        "input_direction": "RIGHT",
        "output_direction": "RIGHT",
        "beat_interval": 1
      }
    },
    {
      "x": 8,
      "y": 12,
      "belt": {
        "input_direction": "RIGHT",
        "output_direction": "UP",
        "beat_interval": 1
      }
    },
    {
      "x": 8,
      "y": 11,
      "belt": {
        "input_direction": "UP",
        "output_direction": "UP",
        "beat_interval": 1
      }
    },
    {
      "x": 8,
      "y": 10,
      "belt": {
        "input_direction": "UP",
        "output_direction": "LEFT",
        "beat_interval": 1
      }
    },
    {
      "x": 7,
      "y": 10,
      "belt": {
        "input_direction": "LEFT",
        "output_direction": "LEFT",
        "beat_interval": 1
      }
    },
    {
      "x": 6,
      "y": 11,
      "belt": {
        "input_direction": "DOWN",
        "output_direction": "RIGHT",
        "beat_interval": 1
      }
    },
    {
      "x": 7,
      "y": 11,
      "recycler": {
        "targets": [
          {
            "product_type": "C",
            "required_count": 3
          }
        ]
      }
    },
    {
      "x": 14,
      "y": 14,
      "signal_tower": {
        "max_steps": 14
      }
    }
  ]
}
